Id,Title,Overview,Tagline,Runtime,Budget,Revenue,PosterUrl,BackdropUrl,ImdbUrl,TmdbUrl,OriginalLanguage,ReleaseDate
732,Non-Stop,"Bill Marks is a burned-out veteran of the Air Marshals service. He views the assignment not as a life-saving duty, but as a desk job in the sky. However, today's flight will be no routine trip. Shortly into the transatlantic journey from New York to London, he receives a series of mysterious text messages ordering him to have the government transfer $150 million into a secret account, or a passenger will die every 20 minutes.",The hijacking was just the beginning.,106,50000000.0000,222809600.0000,https://image.tmdb.org/t/p/w342//Nkgaj3X0W2jHQ1TzHEgWFpN3kJ.jpg,https://image.tmdb.org/t/p/original//7UOWJEhNbePQeGSaVn9PvcRaujX.jpg,https://www.imdb.com/title/tt2024469,https://www.themoviedb.org/movie/225574,en,2014-02-26 00:00:00.0000000
733,Moon,"With only three weeks left in his three year contract, Sam Bell is getting anxious to finally return to Earth. He is the only occupant of a Moon-based manufacturing facility along with his computer and assistant, GERTY. When he has an accident however, he wakens to find that he is not alone.",The last place you'd ever expect to find yourself.,97,5000000.0000,9760104.0000,https://image.tmdb.org/t/p/w342//cJ6JnuLwCNbiAAOBuHDjRTP7bQJ.jpg,https://image.tmdb.org/t/p/original//7by1GIdmBJFHKDz1XJWXCmOztmK.jpg,https://www.imdb.com/title/tt1182345,https://www.themoviedb.org/movie/17431,en,2009-06-12 00:00:00.0000000
734,Monty Python and the Holy Grail,"King Arthur, accompanied by his squire, recruits his Knights of the Round Table, including Sir Bedevere the Wise, Sir Lancelot the Brave, Sir Robin the Not-Quite-So-Brave-As-Sir-Lancelot and Sir Galahad the Pure. On the way, Arthur battles the Black Knight who, despite having had all his limbs chopped off, insists he can still fight. They reach Camelot, but Arthur decides not  to enter, as ""it is a silly place"".",And now! At Last! Another film completely different from some of the other films which aren't quite the same as this one is.,91,400000.0000,5028948.0000,https://image.tmdb.org/t/p/w342//jVztLnCw6F5YNOgEchm3QFydbYZ.jpg,https://image.tmdb.org/t/p/original//nE3wR3UeVaAOmipANbA1fJqIZ29.jpg,https://www.imdb.com/title/tt0071853,https://www.themoviedb.org/movie/762,en,1975-05-25 00:00:00.0000000
735,The Adventures of Tintin,"Intrepid young reporter, Tintin, and his loyal dog, Snowy, are thrust into a world of high adventure when they discover a ship carrying an explosive secret. As Tintin is drawn into a centuries-old mystery, Ivan Ivanovitch Sakharine suspects him of stealing a priceless treasure. Tintin and Snowy, with the help of salty, cantankerous Captain Haddock and bumbling detectives, Thompson and Thomson, travel half the world, one step ahead of their enemies, as Tintin endeavors to find the Unicorn, a sunken ship that may hold a vast fortune, but also an ancient curse.","This year, discover how far adventure will take you.",107,130000000.0000,371940071.0000,https://image.tmdb.org/t/p/w342//mKYkNro2btaWMsnYSuyqrBdHQo3.jpg,https://image.tmdb.org/t/p/original//5parN40mSwZMCP4Ig11lE6keeFi.jpg,https://www.imdb.com/title/tt0983193,https://www.themoviedb.org/movie/17578,en,2011-10-25 00:00:00.0000000
736,Just Go with It,"A plastic surgeon, romancing a much younger schoolteacher, enlists his loyal assistant to pretend to be his soon to be ex-wife, in order to cover up a careless lie. When more lies backfire, the assistant's kids become involved, and everyone heads off for a weekend in Hawaii that will change all their lives.",Sometimes a guy's best wingman... is a wingwoman,117,80000000.0000,214945591.0000,https://image.tmdb.org/t/p/w342//ez1EDULOCUUCySHOZU6tz97qbtM.jpg,https://image.tmdb.org/t/p/original//sRJXffIo0tY2acAUlIThoopsxia.jpg,https://www.imdb.com/title/tt1564367,https://www.themoviedb.org/movie/50546,en,2011-02-10 00:00:00.0000000
737,School of Rock,"Fired from his band and hard up for cash, guitarist and vocalist Dewey Finn finagles his way into a job as a fifth-grade substitute teacher at a private school, where he secretly begins teaching his students the finer points of rock 'n' roll. The school's hard-nosed principal is rightly suspicious of Finn's activities. But Finn's roommate remains in the dark about what he's doing.",He just landed the gig of his life: 5th grade.,110,35000000.0000,131282949.0000,https://image.tmdb.org/t/p/w342//zXLXaepIBvFVLU25DH3wv4IPSbe.jpg,https://image.tmdb.org/t/p/original//pM1CnP0ZN2VxmrTAbBZOS3PNoNE.jpg,https://www.imdb.com/title/tt0332379,https://www.themoviedb.org/movie/1584,en,2003-10-03 00:00:00.0000000
738,The Hurt Locker,"Forced to play a dangerous game of cat-and-mouse in the chaos of war, an elite Army bomb squad unit must come together in a city where everyone is a potential enemy and every object could be a deadly bomb.",You'll know when you're in it.,131,15000000.0000,49230772.0000,https://image.tmdb.org/t/p/w342//8SwjvOchYljr7tSKpNeHjpyPbg5.jpg,https://image.tmdb.org/t/p/original//off0xgvtfHY82l3MC4mDpCk1APY.jpg,https://www.imdb.com/title/tt0887912,https://www.themoviedb.org/movie/12162,en,2008-10-10 00:00:00.0000000
739,The Game,"In honor of his birthday, San Francisco banker Nicholas Van Orton, a financial genius and a cold-hearted loner, receives an unusual present from his younger brother, Conrad: a gift certificate to play a unique kind of game. In nary a nanosecond, Nicholas finds himself consumed by a dangerous set of ever-changing rules, unable to distinguish where the charade ends and reality begins.",What do you get for the man who has everything?,129,50000000.0000,109423648.0000,https://image.tmdb.org/t/p/w342//4UOa079915QjiTA2u5hT2yKVgUu.jpg,https://image.tmdb.org/t/p/original//b2s8QpoY5J0sGHYBF7GrhNfQi6K.jpg,https://www.imdb.com/title/tt0119174,https://www.themoviedb.org/movie/2649,en,1997-09-12 00:00:00.0000000
740,Jack the Giant Slayer,"The story of an ancient war that is reignited when a young farmhand unwittingly opens a gateway between our world and a fearsome race of giants. Unleashed on the Earth for the first time in centuries, the giants strive to reclaim the land they once lost, forcing the young man, Jack into the battle of his life to stop them. Fighting for a kingdom, its people, and the love of a brave princess, he comes face to face with the unstoppable warriors he thought only existed in legend–and gets the chance to become a legend himself.",Prepare for a giant adventure,114,195000000.0000,197687603.0000,https://image.tmdb.org/t/p/w342//xLbVsFpAlwf6khU3gG1yaRBPeC.jpg,https://image.tmdb.org/t/p/original//c7U9Fuy74WLp7gFAdpQJHn2T2no.jpg,https://www.imdb.com/title/tt1351685,https://www.themoviedb.org/movie/81005,en,2013-02-27 00:00:00.0000000
741,Due Date,"Peter Highman must scramble across the US in five days to be present for the birth of his first child. He gets off to a bad start when his wallet and luggage are stolen, and put on the 'no-fly' list. Peter embarks on a terrifying journey when he accepts a ride from an actor.",Leave Your Comfort Zone.,95,65000000.0000,211780824.0000,https://image.tmdb.org/t/p/w342//A0AoOIMjpx6UphAbMZXN02De6ZE.jpg,https://image.tmdb.org/t/p/original//st8hEUnz7LTwyGYTt70t9JAHuvb.jpg,https://www.imdb.com/title/tt1231583,https://www.themoviedb.org/movie/41733,en,2010-11-04 00:00:00.0000000
742,Interview with the Vampire,"A vampire relates his epic life story of love, betrayal, loneliness, and dark hunger to an over-curious reporter.",Drink from me and live forever,123,60000000.0000,223664608.0000,https://image.tmdb.org/t/p/w342//t7NU8IcmcNBrlunCxiycX9JV7Rp.jpg,https://image.tmdb.org/t/p/original//3fChciF2G1wXHsyTfJD9y7uN6Il.jpg,https://www.imdb.com/title/tt0110148,https://www.themoviedb.org/movie/628,en,1994-11-11 00:00:00.0000000
743,The Goonies,"A young teenager named Mikey Walsh finds an old treasure map in his father's attic. Hoping to save their homes from demolition, Mikey and his friends Data Wang, Chunk Cohen, and Mouth Devereaux run off on a big quest to find the secret stash of Pirate One-Eyed Willie.",,114,19000000.0000,61389680.0000,https://image.tmdb.org/t/p/w342//eBU7gCjTCj9n2LTxvCSIXXOvHkD.jpg,https://image.tmdb.org/t/p/original//imtHhH4NuKMMaSityrxhuSmtyd3.jpg,https://www.imdb.com/title/tt0089218,https://www.themoviedb.org/movie/9340,en,1985-06-07 00:00:00.0000000
744,Kung Fu Panda 3,"Continuing his ""legendary adventures of awesomeness"", Po must face two hugely epic, but different threats: one supernatural and the other a little closer to his home.",Grab destiny by the rice dumplings.,95,145000000.0000,521170825.0000,https://image.tmdb.org/t/p/w342//nlr2oxuYsHXt0wdtmzaOuVBoNC0.jpg,https://image.tmdb.org/t/p/original//kHgWFKSa0NUItppt6uW2JT1ezuQ.jpg,https://www.imdb.com/title/tt2267968,https://www.themoviedb.org/movie/140300,en,2016-01-23 00:00:00.0000000
745,Percy Jackson: Sea of Monsters,"In their quest to confront the ultimate evil, Percy and his friends battle swarms of mythical creatures to find the mythical Golden Fleece and to stop an ancient evil from rising.","Where There Are Gods, There Are Monsters.",106,90000000.0000,199850315.0000,https://image.tmdb.org/t/p/w342//y4j0oCo6v6G3GKCumMjy4QdFlmR.jpg,https://image.tmdb.org/t/p/original//zkKKtYfvoGbK4yl4aPfLf65bUO8.jpg,https://www.imdb.com/title/tt1854564,https://www.themoviedb.org/movie/76285,en,2013-08-07 00:00:00.0000000
746,Who Framed Roger Rabbit,"'Toon star Roger is worried that his wife Jessica is playing pattycake with someone else, so the studio hires detective Eddie Valiant to snoop on her. But the stakes are quickly raised when Marvin Acme is found dead and Roger is the prime suspect.","It's the story of a man, a woman, and a rabbit in a triangle of trouble.",104,70000000.0000,329803958.0000,https://image.tmdb.org/t/p/w342//lYfRc57Kx9VgLZ48iulu0HKnM15.jpg,https://image.tmdb.org/t/p/original//udtMhgdfHxWmxJYRaJluVSg80Fm.jpg,https://www.imdb.com/title/tt0096438,https://www.themoviedb.org/movie/856,en,1988-06-21 00:00:00.0000000
747,The Wizard of Oz,"Young Dorothy finds herself in a magical world where she makes friends with a lion, a scarecrow and a tin man as they make their way along the yellow brick road to talk with the Wizard and ask for the things they miss most in their lives. The Wicked Witch of the West is the only thing that could stop them.","We're off to see the Wizard, the wonderful Wizard of Oz!",102,2777000.0000,33754967.0000,https://image.tmdb.org/t/p/w342//pfAZFD7I2hxW9HCChTuAzsdE6UX.jpg,https://image.tmdb.org/t/p/original//qAvou7F5P4VcIR72JzzrnKEQSN3.jpg,https://www.imdb.com/title/tt0032138,https://www.themoviedb.org/movie/630,en,1939-08-15 00:00:00.0000000
748,Peter Pan,"Leaving the safety of their nursery behind, Wendy, Michael and John follow Peter Pan to a magical world where childhood lasts forever. But while in Neverland, the kids must face Captain Hook and foil his attempts to get rid of Peter for good.",It will live in your heart forever!,77,4000000.0000,87404651.0000,https://image.tmdb.org/t/p/w342//6UTZmeQcxbtW32MyR5nKIx7ID4f.jpg,https://image.tmdb.org/t/p/original//1vdEUx5sZi2leQOefOV0h2c9LYs.jpg,https://www.imdb.com/title/tt0046183,https://www.themoviedb.org/movie/10693,en,1953-02-05 00:00:00.0000000
749,The Italian Job,"Charlie Croker pulled off the crime of a lifetime. The one thing that he didn't plan on was being double-crossed. Along with a drop-dead gorgeous safecracker, Croker and his team take off to re-steal the loot and end up in a pulse-pounding, pedal-to-the-metal chase that careens up, down, above and below the streets of Los Angeles.",Get in. Get out. Get even.,110,60000000.0000,176070171.0000,https://image.tmdb.org/t/p/w342//eSkjK4kctyrWpFhxl35GPvSs6tI.jpg,https://image.tmdb.org/t/p/original//wryDL17raofFbO5AfhH1WSm034Y.jpg,https://www.imdb.com/title/tt0317740,https://www.themoviedb.org/movie/9654,en,2003-05-30 00:00:00.0000000
750,Ghost,"Sam Wheat is a banker, Molly Jensen is an artist, and the two are madly in love. However, when Sam is murdered by his friend and corrupt business partner Carl Bruner over a shady business deal, he is left to roam the earth as a powerless spirit. When he learns of Carl's betrayal, Sam must seek the help of psychic Oda Mae Brown to set things right and protect Molly from Carl and his goons.",A love that will last forever.,127,22000000.0000,505000000.0000,https://image.tmdb.org/t/p/w342//hQtKB7wU2BDAtdnpGSzFCoZjKie.jpg,https://image.tmdb.org/t/p/original//6nLdSON3ErniBZTXWG7WRqs5jGz.jpg,https://www.imdb.com/title/tt0099653,https://www.themoviedb.org/movie/251,en,1990-07-12 00:00:00.0000000
751,Inside Man,"When an armed, masked gang enter a Manhattan bank, lock the doors and take hostages, the detective assigned to effect their release enters negotiations preoccupied with corruption charges he is facing.",It looked like the perfect bank robbery. But you can’t judge a crime by its cover.,129,45000000.0000,186003591.0000,https://image.tmdb.org/t/p/w342//mf4i9zZVXMmqWsEb9D0OAY7k3t.jpg,https://image.tmdb.org/t/p/original//8b4vDh7hNSLZKyAYUnZJalExbJb.jpg,https://www.imdb.com/title/tt0454848,https://www.themoviedb.org/movie/388,en,2006-03-17 00:00:00.0000000
752,Die Hard 2,"Off-duty cop John McClane is gripped with a feeling of déjà vu when, on a snowy Christmas Eve in the nation’s capital, terrorists seize a major international airport, holding thousands of holiday travelers hostage. Renegade military commandos led by a murderous rogue officer plot to rescue a drug lord from justice and are prepared for every contingency except one: McClane’s smart-mouthed heroics.",Die Harder,124,70000000.0000,240031094.0000,https://image.tmdb.org/t/p/w342//wUEizkONxPZmIWQ2lnMttW0suXH.jpg,https://image.tmdb.org/t/p/original//fgkgab4Rel0nOI3B3scHeNB4Mn6.jpg,https://www.imdb.com/title/tt0099423,https://www.themoviedb.org/movie/1573,en,1990-07-02 00:00:00.0000000
753,Boyhood,"The film tells a story of a divorced couple trying to raise their young son. The story follows the boy for twelve years, from first grade at age 6 through 12th grade at age 17-18, and examines his relationship with his parents as he grows.",12 years in the making.,165,4000000.0000,44349000.0000,https://image.tmdb.org/t/p/w342//1rlqd3j5UC4r1TF3UmcKupMyuxR.jpg,https://image.tmdb.org/t/p/original//Ac2s9RJEi1ZeaQopoLsqlsmWQmx.jpg,https://www.imdb.com/title/tt1065073,https://www.themoviedb.org/movie/85350,en,2014-06-05 00:00:00.0000000
754,The Shallows,"When Nancy is surfing on a secluded beach, she finds herself on the feeding ground of a great white shark. Though she is stranded only 200 yards from shore, survival proves to be the ultimate test of wills, requiring all of Nancy's ingenuity, resourcefulness, and fortitude.",What was once in the deep is now in the shallows.,86,17000000.0000,119100758.0000,https://image.tmdb.org/t/p/w342//42HlPJmiE6rQdtT2lYzPPMQYvqG.jpg,https://image.tmdb.org/t/p/original//r22CQDvFWFTcYgamVG0vKMeuyyC.jpg,https://www.imdb.com/title/tt4052882,https://www.themoviedb.org/movie/332567,en,2016-06-24 00:00:00.0000000
755,The Island,"In 2019, Lincoln Six-Echo is a resident of a seemingly ""Utopian"" but contained facility. Like all of the inhabitants of this carefully-controlled environment, Lincoln hopes to be chosen to go to The Island — reportedly the last uncontaminated location on the planet. But Lincoln soon discovers that everything about his existence is a lie.",Your time will come...,136,126000000.0000,162949164.0000,https://image.tmdb.org/t/p/w342//rJonkVkNZB23VLeoA8iGvWWZ88Z.jpg,https://image.tmdb.org/t/p/original//zZZ1FDl5FPClZ9OnMrlaPA4Iuxv.jpg,https://www.imdb.com/title/tt0399201,https://www.themoviedb.org/movie/1635,en,2005-07-21 00:00:00.0000000
756,Brother Bear,"When an impulsive boy named Kenai is magically transformed into a bear, he must literally walk in another's footsteps until he learns some valuable life lessons. His courageous and often zany journey introduces him to a forest full of wildlife, including the lovable bear cub Koda, hilarious moose Rutt and Tuke, woolly mammoths and rambunctious rams.",Nature Calls,85,128000000.0000,250397798.0000,https://image.tmdb.org/t/p/w342//9VvLgj28J5m04y5gO0mt5np4yF8.jpg,https://image.tmdb.org/t/p/original//nMKfeFtE9bML6yjdcymrt5vtaNz.jpg,https://www.imdb.com/title/tt0328880,https://www.themoviedb.org/movie/10009,en,2003-10-23 00:00:00.0000000
757,Eyes Wide Shut,"After Dr. Bill Harford's wife, Alice, admits to having sexual fantasies about a man she met, Bill becomes obsessed with having a sexual encounter. He discovers an underground sexual group and attends one of their meetings -- and quickly discovers that he is in over his head.",Cruise. Kidman. Kubrick.,159,65000000.0000,162091208.0000,https://image.tmdb.org/t/p/w342//a0YOhU3zq0RkOYrVlPXCeE1oFkR.jpg,https://image.tmdb.org/t/p/original//dFSF6cIzacFsgOBIfsztd90AIyj.jpg,https://www.imdb.com/title/tt0120663,https://www.themoviedb.org/movie/345,en,1999-07-16 00:00:00.0000000
758,The Devil's Advocate,"Aspiring Florida defense lawyer Kevin Lomax accepts a job at a New York law firm. With the stakes getting higher every case, Kevin quickly learns that his boss has something far more evil planned.",Evil has its winning ways.,144,57000000.0000,152944660.0000,https://image.tmdb.org/t/p/w342//5ZzBGpxy55OQzHxKVY11IpY6a0o.jpg,https://image.tmdb.org/t/p/original//i9lR2jLV0dHVfVs1u6QqqbQAE9I.jpg,https://www.imdb.com/title/tt0118971,https://www.themoviedb.org/movie/1813,en,1997-10-17 00:00:00.0000000
759,Black Hawk Down,"When U.S. Rangers and an elite Delta Force team attempt to kidnap two underlings of a Somali warlord, their Black Hawk helicopters are shot down, and the Americans suffer heavy casualties, facing intense fighting from the militia on the ground.",Leave No Man Behind.,145,92000000.0000,172989651.0000,https://image.tmdb.org/t/p/w342//7fU5dSqKRL4XHeEUz62rCKBfYok.jpg,https://image.tmdb.org/t/p/original//mReQOInw7jOOstY6Y9HLUvlXMXD.jpg,https://www.imdb.com/title/tt0265086,https://www.themoviedb.org/movie/855,en,2001-12-28 00:00:00.0000000
760,Stand by Me,"Gordie, Chris, Teddy and Vern are four friends who decide to hike to find the corpse of Ray Brower, a local teenager, who was hit by a train while plucking blueberries in the wild.","For some, it's the last real taste of innocence, and the first real taste of life.",89,8000000.0000,52287414.0000,https://image.tmdb.org/t/p/w342//vz0w9BSehcqjDcJOjRaCk7fgJe7.jpg,https://image.tmdb.org/t/p/original//ljIF1JjdUUJtVW55x77vWSJxizQ.jpg,https://www.imdb.com/title/tt0092005,https://www.themoviedb.org/movie/235,en,1986-08-08 00:00:00.0000000
761,The World's End,Five friends who reunite in an attempt to top their epic pub crawl from 20 years earlier unwittingly become humankind's only hope for survival.,Good food. Fine ales. Total Annihilation.,109,20000000.0000,46089287.0000,https://image.tmdb.org/t/p/w342//kpglnOBYmKn0AkkWDzGxzKHDbds.jpg,https://image.tmdb.org/t/p/original//cYDzmKptAh4hu3SFuto0cZGNB86.jpg,https://www.imdb.com/title/tt1213663,https://www.themoviedb.org/movie/107985,en,2013-07-18 00:00:00.0000000
762,Five Feet Apart,"Seventeen-year-old Stella spends most of her time in the hospital as a cystic fibrosis patient. Her life is full of routines, boundaries and self-control — all of which get put to the test when she meets Will, an impossibly charming teen who has the same illness. There's an instant flirtation, though restrictions dictate that they must maintain a safe distance between them. As their connection intensifies, so does the temptation to throw the rules out the window and embrace that attraction.","When Life Keeps You Apart, Fight For Every Inch.",116,7000000.0000,91500000.0000,https://image.tmdb.org/t/p/w342//kreTuJBkUjVWePRfhHZuYfhNE1T.jpg,https://image.tmdb.org/t/p/original//cYdHaKx6Ihj1BIvbxpCxIGXfZ02.jpg,https://www.imdb.com/title/tt6472976,https://www.themoviedb.org/movie/527641,en,2019-03-15 00:00:00.0000000
763,Mars Attacks!,"'We come in peace' is not what those green men from Mars mean when they invade our planet, armed with irresistible weapons and a cruel sense of humor.  This star studded cast must play victim to the alien’s fun and games in this comedy homage to science fiction films of the '50s and '60s.",Nice planet. We'll take it!,106,70000000.0000,101371017.0000,https://image.tmdb.org/t/p/w342//hll4O5vSAfnZDb6JbnP06GPtz7b.jpg,https://image.tmdb.org/t/p/original//ELsTifJ2lu4vsMhoHeZ5EnncHw.jpg,https://www.imdb.com/title/tt0116996,https://www.themoviedb.org/movie/75,en,1996-12-12 00:00:00.0000000
764,Lady and the Tramp,"Lady, a golden cocker spaniel, meets up with a mongrel dog who calls himself the Tramp. He is obviously from the wrong side of town, but happenings at Lady's home make her decide to travel with him for a while.",She's from the leash and license set... he's footloose and collar free!,76,4000000.0000,36359037.0000,https://image.tmdb.org/t/p/w342//wXKeGea4htM7Yz3yo7hYXbs3FhV.jpg,https://image.tmdb.org/t/p/original//deZYjgLWPHStzvk7hCgf8pBqFdC.jpg,https://www.imdb.com/title/tt0048280,https://www.themoviedb.org/movie/10340,en,1955-06-22 00:00:00.0000000
765,Signs,A family living on a farm finds mysterious crop circles in their fields which suggests something more frightening to come.,It’s not like they didn’t warn us.,106,72000000.0000,408247917.0000,https://image.tmdb.org/t/p/w342//hyZkNEbNgnciUVTyu4NZTjlCh4L.jpg,https://image.tmdb.org/t/p/original//aMiI1j9L8V1EBL0CNZaekQC9AW3.jpg,https://www.imdb.com/title/tt0286106,https://www.themoviedb.org/movie/2675,en,2002-08-02 00:00:00.0000000
766,Training Day,"On his first day on the job as a narcotics officer, a rookie cop works with a rogue detective who isn't what he appears.","The only thing more dangerous than the line being crossed, is the cop who will cross it.",122,45000000.0000,104876233.0000,https://image.tmdb.org/t/p/w342//sEQansIwI6SfNSpop3N0EBZayWk.jpg,https://image.tmdb.org/t/p/original//nEQ6H2ih2caDHnkmJqiOC0m0fKk.jpg,https://www.imdb.com/title/tt0139654,https://www.themoviedb.org/movie/2034,en,2001-10-05 00:00:00.0000000
767,Total Recall,"Construction worker Douglas Quaid discovers a memory chip in his brain during a virtual-reality trip. He also finds that his past has been invented to conceal a plot of planetary domination. Soon, he's off to Mars to find out who he is and who planted the chip.","They stole his mind, now he wants it back.",113,65000000.0000,261317921.0000,https://image.tmdb.org/t/p/w342//wVbeL6fkbTKSmNfalj4VoAUUqJv.jpg,https://image.tmdb.org/t/p/original//ergECcue7gOAV5zvnKm5IIVFmKE.jpg,https://www.imdb.com/title/tt0100802,https://www.themoviedb.org/movie/861,en,1990-06-01 00:00:00.0000000
768,The Purge: Election Year,"Two years after choosing not to kill the man who killed his son, former police sergeant Leo Barnes has become head of security for Senator Charlene Roan, the front runner in the next Presidential election due to her vow to eliminate the Purge. On the night of what should be the final Purge, a betrayal from within the government forces Barnes and Roan out onto the street where they must fight to survive the night.",Keep America great,105,10000000.0000,118587880.0000,https://image.tmdb.org/t/p/w342//ubLbY97m8lYJ3Fykh7nfiwB5eth.jpg,https://image.tmdb.org/t/p/original//qq9Whyz2tmIh5MjGN5or1S6Q9MZ.jpg,https://www.imdb.com/title/tt4094724,https://www.themoviedb.org/movie/316727,en,2016-06-29 00:00:00.0000000
769,The Untouchables,"Young Treasury Agent Elliot Ness arrives in Chicago and is determined to take down Al Capone, but it's not going to be easy because Capone has the police in his pocket. Ness meets Jimmy Malone, a veteran patrolman and probably the most honorable one on the force. He asks Malone to help him get Capone, but Malone warns him that if he goes after Capone, he is going to war.",What are you prepared to do?,119,25000000.0000,76270454.0000,https://image.tmdb.org/t/p/w342//iK4twY48a1nVCez0qXE5w4JFvXw.jpg,https://image.tmdb.org/t/p/original//i1oWUGVDNBhGBykcCRBlX326udb.jpg,https://www.imdb.com/title/tt0094226,https://www.themoviedb.org/movie/117,en,1987-06-03 00:00:00.0000000
770,The Kissing Booth 2,"With college decisions looming, Elle juggles her long-distance romance with Noah, changing relationship with bestie Lee and feelings for a new classmate.",Rules can be broken...but so can hearts.,132,0.0000,0.0000,https://image.tmdb.org/t/p/w342//mb7wQv0adK3kjOUr9n93mANHhPJ.jpg,https://image.tmdb.org/t/p/original//wO5QSWZPBT71gMLvrRex0bVc0V9.jpg,https://www.imdb.com/title/tt9784456,https://www.themoviedb.org/movie/583083,en,2020-07-24 00:00:00.0000000
771,Hook,"The boy who wasn't supposed grow up—Peter Pan—does just that, becoming a soulless corporate lawyer whose workaholism could cost him his wife and kids. During his trip to see Granny Wendy in London, the vengeful Capt. Hook kidnaps Peter's kids and forces Peter to return to Neverland.",What if Peter Pan grew up?,142,70000000.0000,300855000.0000,https://image.tmdb.org/t/p/w342//a6rB1lGXoGms7gWxRfJneQmAjNV.jpg,https://image.tmdb.org/t/p/original//6X0TfbTLe4NENu8GK3pZWSd7zvv.jpg,https://www.imdb.com/title/tt0102057,https://www.themoviedb.org/movie/879,en,1991-04-10 00:00:00.0000000
