Id,Title,Overview,Tagline,Runtime,Budget,Revenue,PosterUrl,BackdropUrl,ImdbUrl,TmdbUrl,OriginalLanguage,ReleaseDate
490,Big Fish,"Throughout his life Edward Bloom has always been a man of big appetites, enormous passions and tall tales. In his later years, he remains a huge mystery to his son, William. Now, to get to know the real man, Will begins piecing together a true picture of his father from flashbacks of his amazing adventures.",An adventure as big as life itself.,125,70000000.0000,123218424.0000,https://image.tmdb.org/t/p/w342//tjK063yCgaBAluVU72rZ6PKPH2l.jpg,https://image.tmdb.org/t/p/original//4VAZwbPqy8nuL15JhTz1CwBxV2L.jpg,https://www.imdb.com/title/tt0319061,https://www.themoviedb.org/movie/587,en,2003-12-25 00:00:00.0000000
491,Jupiter Ascending,"In a universe where human genetic material is the most precious commodity, an impoverished young Earth woman becomes the key to strategic maneuvers and internal strife within a powerful dynasty…",Expand your universe.,127,176000003.0000,183987723.0000,https://image.tmdb.org/t/p/w342//2NCcAZ3M3F0FxENYmammBknwpVn.jpg,https://image.tmdb.org/t/p/original//oj6p9FvZ9sYZT4c9eP3o6S7VOYD.jpg,https://www.imdb.com/title/tt1617661,https://www.themoviedb.org/movie/76757,en,2015-02-04 00:00:00.0000000
492,Despicable Me 3,Gru and his wife Lucy must stop former '80s child star Balthazar Bratt from achieving world domination.,Oh brother.,96,80000000.0000,1031552585.0000,https://image.tmdb.org/t/p/w342//6t3YWl7hrr88lCEFlGVqW5yV99R.jpg,https://image.tmdb.org/t/p/original//ftRkFtAGuHngHnLiOxktq0aCVMF.jpg,https://www.imdb.com/title/tt3469046,https://www.themoviedb.org/movie/324852,en,2017-06-15 00:00:00.0000000
493,Ralph Breaks the Internet,"Video game bad guy Ralph and fellow misfit Vanellope von Schweetz must risk it all by traveling to the World Wide Web in search of a replacement part to save Vanellope's video game, Sugar Rush. In way over their heads, Ralph and Vanellope rely on the citizens of the internet — the netizens — to help navigate their way, including an entrepreneur named Yesss, who is the head algorithm and the heart and soul of trend-making site BuzzzTube.",Who Broke the Internet?,117,175000000.0000,529221154.0000,https://image.tmdb.org/t/p/w342//qEnH5meR381iMpmCumAIMswcQw2.jpg,https://image.tmdb.org/t/p/original//qDQEQbgP3v7B9IYLAUcYexNrVYP.jpg,https://www.imdb.com/title/tt5848272,https://www.themoviedb.org/movie/404368,en,2018-11-20 00:00:00.0000000
494,12 Angry Men,"The defense and the prosecution have rested and the jury is filing into the jury room to decide if a young Spanish-American is guilty or innocent of murdering his father. What begins as an open and shut case soon becomes a mini-drama of each of the jurors' prejudices and preconceptions about the trial, the accused, and each other.",Life is in their hands. Death is on their minds.,97,350000.0000,1000000.0000,https://image.tmdb.org/t/p/w342//wh0f80G6GZvYBNiYmvqFngt3IYq.jpg,https://image.tmdb.org/t/p/original//qqHQsStV6exghCM7zbObuYBiYxw.jpg,https://www.imdb.com/title/tt0050083,https://www.themoviedb.org/movie/389,en,1957-04-10 00:00:00.0000000
495,Hot Fuzz,"As a former London constable, Nicholas Angel finds it difficult to adapt to his new assignment in the sleepy British village of Sandford. Not only does he miss the excitement of the big city, but he also has a well-meaning oaf for a partner. However, when a series of grisly accidents rocks Sandford, Angel smells something rotten in the idyllic village.",Big cops. Small town. Moderate violence.,121,12000000.0000,80573774.0000,https://image.tmdb.org/t/p/w342//zPib4ukTSdXvHP9pxGkFCe34f3y.jpg,https://image.tmdb.org/t/p/original//uFUm3ehg69VwtHf3ryMzPZXqRtd.jpg,https://www.imdb.com/title/tt0425112,https://www.themoviedb.org/movie/4638,en,2007-02-14 00:00:00.0000000
496,Batman,"Batman must face his most ruthless nemesis when a deformed madman calling himself ""The Joker"" seizes control of Gotham's criminal underworld.",Have you ever danced with the devil in the pale moonlight?,126,35000000.0000,411348924.0000,https://image.tmdb.org/t/p/w342//tDexQyu6FWltcd0VhEDK7uib42f.jpg,https://image.tmdb.org/t/p/original//2va32apQP97gvUxaMnL5wYt4CRB.jpg,https://www.imdb.com/title/tt0096895,https://www.themoviedb.org/movie/268,en,1989-06-23 00:00:00.0000000
497,Teenage Mutant Ninja Turtles,The city needs heroes. Darkness has settled over New York City as Shredder and his evil Foot Clan have an iron grip on everything from the police to the politicians. The future is grim until four unlikely outcast brothers rise from the sewers and discover their destiny as Teenage Mutant Ninja Turtles. The Turtles must work with fearless reporter April and her wise-cracking cameraman Vern Fenwick to save the city and unravel Shredder's diabolical plan.,Mysterious. Dangerous. Reptilious. You've never seen heroes like this.,101,125000000.0000,477200000.0000,https://image.tmdb.org/t/p/w342//azL2ThbJMIkts3ZMt3j1YgBUeDB.jpg,https://image.tmdb.org/t/p/original//eezsbzYPbYKjjh6E1XHDBNlLynh.jpg,https://www.imdb.com/title/tt1291150,https://www.themoviedb.org/movie/98566,en,2014-08-07 00:00:00.0000000
498,Wanted,"Doormat Wesley Gibson discovers that his recently murdered father – who Wesley never knew – belonged to a secret guild of assassins. After a leather-clad sexpot drafts Wesley into the society, he hones his innate killing skills and turns avenger.",Choose your destiny.,110,75000000.0000,341432090.0000,https://image.tmdb.org/t/p/w342//rTvUr2ESdZ1Ht5zNbgUNmNEHyUT.jpg,https://image.tmdb.org/t/p/original//qqhzXiNyCotzJdyEbi41EtzYYYI.jpg,https://www.imdb.com/title/tt0493464,https://www.themoviedb.org/movie/8909,en,2008-06-19 00:00:00.0000000
499,Ocean's Twelve,"Danny Ocean reunites with his old flame and the rest of his merry band of thieves in carrying out three huge heists in Rome, Paris and Amsterdam – but a Europol agent is hot on their heels.",Twelve is the new eleven.,125,110000000.0000,362744280.0000,https://image.tmdb.org/t/p/w342//4y8WH1lIpXp0qxUWkYmObhuMRIU.jpg,https://image.tmdb.org/t/p/original//3guCfwRt3MrmO6q56I4F5xN1LYB.jpg,https://www.imdb.com/title/tt0349903,https://www.themoviedb.org/movie/163,en,2004-12-09 00:00:00.0000000
500,Pitch Perfect,"College student Beca knows she does not want to be part of a clique, but that's exactly where she finds herself after arriving at her new school. Thrust in among mean gals, nice gals and just plain weird gals, Beca finds that the only thing they have in common is how well they sing together. She takes the women of the group out of their comfort zone of traditional arrangements and into a world of amazing harmonic combinations in a fight to the top of college music competitions.",Get pitch slapped.,112,17000000.0000,115400000.0000,https://image.tmdb.org/t/p/w342//gsFoJk9g8W3zgaipRrrURk7LbiF.jpg,https://image.tmdb.org/t/p/original//zZoSxRhNwdqSBB5mVmRpXEwKFWv.jpg,https://www.imdb.com/title/tt1981677,https://www.themoviedb.org/movie/114150,en,2012-09-28 00:00:00.0000000
501,Sully,"On 15 January 2009, the world witnessed the 'Miracle on the Hudson' when Captain 'Sully' Sullenberger glided his disabled plane onto the frigid waters of the Hudson River, saving the lives of all 155 aboard. However, even as Sully was being heralded by the public and the media for his unprecedented feat of aviation skill, an investigation was unfolding that threatened to destroy his reputation and career.",The Untold Story Behind the Miracle on the Hudson.,96,60000000.0000,240797623.0000,https://image.tmdb.org/t/p/w342//r09ivJ1GGh5WArqRViRYDQLrTVG.jpg,https://image.tmdb.org/t/p/original//x4tnywLA8LY3jsRCbw4Ewj1nDL6.jpg,https://www.imdb.com/title/tt3263904,https://www.themoviedb.org/movie/363676,en,2016-09-07 00:00:00.0000000
502,After Earth,"One thousand years after cataclysmic events forced humanity's escape from Earth, Nova Prime has become mankind's new home. Legendary General Cypher Raige returns from an extended tour of duty to his estranged family, ready to be a father to his 13-year-old son, Kitai. When an asteroid storm damages Cypher and Kitai's craft, they crash-land on a now unfamiliar and dangerous Earth. As his father lies dying in the cockpit, Kitai must trek across the hostile terrain to recover their rescue beacon. His whole life, Kitai has wanted nothing more than to be a soldier like his father. Today, he gets his chance.","Danger is real, fear is a choice",100,130000000.0000,243843127.0000,https://image.tmdb.org/t/p/w342//kteClJzPpygDW40xyICWfzmYTIW.jpg,https://image.tmdb.org/t/p/original//958IEMxVqU3FFOdZll3PcFLoyef.jpg,https://www.imdb.com/title/tt1815862,https://www.themoviedb.org/movie/82700,en,2013-05-30 00:00:00.0000000
503,Creed,"The former World Heavyweight Champion Rocky Balboa serves as a trainer and mentor to Adonis Johnson, the son of his late friend and former rival Apollo Creed.",Your legacy is more than a name,133,37000000.0000,173567581.0000,https://image.tmdb.org/t/p/w342//iBq4od6j1ZAvDVO7hwmHT2Xf2Bt.jpg,https://image.tmdb.org/t/p/original//kODNw6GJNdgldUMEhKPlCw8wQCr.jpg,https://www.imdb.com/title/tt3076658,https://www.themoviedb.org/movie/312221,en,2015-11-25 00:00:00.0000000
504,The Butterfly Effect,"A young man struggles to access sublimated childhood memories. He finds a technique that allows him to travel back into the past, to occupy his childhood body and change history. However, he soon finds that every change he makes has unexpected consequences.",Change one thing. Change everything.,113,13000000.0000,96060858.0000,https://image.tmdb.org/t/p/w342//jY0hIz8eolynHqWN8vrTo0cypBI.jpg,https://image.tmdb.org/t/p/original//Aj2gjpdDwJlAxuMB5tiOOXmCipr.jpg,https://www.imdb.com/title/tt0289879,https://www.themoviedb.org/movie/1954,en,2004-01-22 00:00:00.0000000
505,Allegiant,Beatrice Prior and Tobias Eaton venture into the world outside of the fence and are taken into protective custody by a mysterious agency known as the Bureau of Genetic Welfare.,Break the boundaries of your world,121,110000000.0000,179246868.0000,https://image.tmdb.org/t/p/w342//ecDWL1WvcAVxZOmoYxa6c1tuTCL.jpg,https://image.tmdb.org/t/p/original//xXWfaEciAOQJxNaggdSKbS4Z82H.jpg,https://www.imdb.com/title/tt3410834,https://www.themoviedb.org/movie/262504,en,2016-03-09 00:00:00.0000000
506,Rocky,"When world heavyweight boxing champion, Apollo Creed wants to give an unknown fighter a shot at the title as a publicity stunt, his handlers choose palooka Rocky Balboa, an uneducated collector for a Philadelphia loan shark. Rocky teams up with trainer  Mickey Goldmill to make the most of this once in a lifetime break.",His whole life was a million-to-one shot.,120,1000000.0000,117235147.0000,https://image.tmdb.org/t/p/w342//i5xiwdSsrecBvO7mIfAJixeEDSg.jpg,https://image.tmdb.org/t/p/original//19lkX9IGhVDLGqOdXT5HjXsRcez.jpg,https://www.imdb.com/title/tt0075148,https://www.themoviedb.org/movie/1366,en,1976-11-21 00:00:00.0000000
507,Night at the Museum: Battle of the Smithsonian,"Hapless museum night watchman Larry Daley must help his living, breathing exhibit friends out of a pickle now that they've been transferred to the archives at the Smithsonian Institution. Larry's (mis)adventures this time include close encounters with Amelia Earhart, Abe Lincoln and Ivan the Terrible.",When the lights go off the battle is on.,105,150000000.0000,413106170.0000,https://image.tmdb.org/t/p/w342//dNvYjzFuSSY7DCVZK7zzaZFemHt.jpg,https://image.tmdb.org/t/p/original//mzRmuaRJqvohZEcdZ290OsLghjN.jpg,https://www.imdb.com/title/tt1078912,https://www.themoviedb.org/movie/18360,en,2009-05-20 00:00:00.0000000
508,Predator,"Dutch and his group of commandos are hired by the CIA to rescue downed airmen from guerillas in a Central American jungle. The mission goes well but as they return they find that something is hunting them. Nearly invisible, it blends in with the forest, taking trophies from the bodies of its victims as it goes along. Occasionally seeing through its eyes, the audience sees it is an intelligent alien hunter, hunting them for sport, killing them off one at a time.",Soon the hunt will begin.,107,15000000.0000,98267558.0000,https://image.tmdb.org/t/p/w342//biznhvfedHPp9GKjlVFXH6OZtyU.jpg,https://image.tmdb.org/t/p/original//qpS5pfZJcirPTDpvckpczKJIsO0.jpg,https://www.imdb.com/title/tt0093773,https://www.themoviedb.org/movie/106,en,1987-06-12 00:00:00.0000000
509,The Croods,"The prehistoric Croods family live in a particularly dangerous moment in time. Patriarch Grug, his mate Ugga, teenage daughter Eep, son Thunk, and feisty Gran gather food by day and huddle together in a cave at night. When a more evolved caveman named Guy arrives on the scene, Grug is distrustful, but it soon becomes apparent that Guy is correct about the impending destruction of their world.",Meet the first modern family.,98,135000000.0000,587204668.0000,https://image.tmdb.org/t/p/w342//27zvjVOtOi5ped1HSlJKNsKXkFH.jpg,https://image.tmdb.org/t/p/original//7JCYI5Xrgt21fEQXIZ2ZFCRhyqK.jpg,https://www.imdb.com/title/tt0481499,https://www.themoviedb.org/movie/49519,en,2013-03-20 00:00:00.0000000
510,Prince of Persia: The Sands of Time,"A rogue prince reluctantly joins forces with a mysterious princess and together, they race against dark forces to safeguard an ancient dagger capable of releasing the Sands of Time – gift from the gods that can reverse time and allow its possessor to rule the world.",Defy the Future,116,150000000.0000,335154643.0000,https://image.tmdb.org/t/p/w342//lkp1GFmWyf7k2WKvKIQuuGyichI.jpg,https://image.tmdb.org/t/p/original//is8UPs1kyGTDX28BQ7z5lsGj93p.jpg,https://www.imdb.com/title/tt0473075,https://www.themoviedb.org/movie/9543,en,2010-05-19 00:00:00.0000000
511,Seven Pounds,An IRS agent with a fateful secret embarks on an extraordinary journey of redemption by forever changing the lives of seven strangers.,Seven names. Seven strangers. One secret.,123,55000000.0000,168167691.0000,https://image.tmdb.org/t/p/w342//pCVpsCEYtvtlg1I9h3rtglKgThu.jpg,https://image.tmdb.org/t/p/original//rtF1PIZw06OyIR0KYgVRxK8TKC7.jpg,https://www.imdb.com/title/tt0814314,https://www.themoviedb.org/movie/11321,en,2008-12-18 00:00:00.0000000
512,Lion,"A five-year-old Indian boy gets lost on the streets of Calcutta, thousands of kilometers from home. He survives many challenges before being adopted by a couple in Australia; 25 years later, he sets out to find his lost family.",The search begins,118,12000000.0000,140312928.0000,https://image.tmdb.org/t/p/w342//kCELJH1tCmaRLqvwIgKDb09aEaw.jpg,https://image.tmdb.org/t/p/original//fgffluhvdOv79SkYaKrfRA0xkf4.jpg,https://www.imdb.com/title/tt3741834,https://www.themoviedb.org/movie/334543,en,2016-01-20 00:00:00.0000000
513,Cloverfield,From visionary producer J.J. Abrams (Lost) and director Matt Reeves comes the worldwide sensation of non-stop terror and suspense everyone is talking about.,Some Thing Has Found Us,85,25000000.0000,170764026.0000,https://image.tmdb.org/t/p/w342//qIegUGJqyMMCRjkKV1s7A9MqdJ8.jpg,https://image.tmdb.org/t/p/original//zuz9kkacCnMsKxIc3SjDwJ1yzba.jpg,https://www.imdb.com/title/tt1060277,https://www.themoviedb.org/movie/7191,en,2008-01-15 00:00:00.0000000
514,Click,"A married workaholic, Michael Newman doesn't have time for his wife and children, not if he's to impress his ungrateful boss and earn a well-deserved promotion. So when he meets Morty, a loopy sales clerk, he gets the answer to his prayers: a magical remote that allows him to bypass life's little distractions with increasingly hysterical results.",What If You Had A Remote... That Controlled Your Universe?,107,82500000.0000,240685326.0000,https://image.tmdb.org/t/p/w342//oL0k5JA53PyoHSZqKb3cNkhwBCE.jpg,https://image.tmdb.org/t/p/original//oXOyyivjQv660pMBfPvt06bMYhJ.jpg,https://www.imdb.com/title/tt0389860,https://www.themoviedb.org/movie/9339,en,2006-06-23 00:00:00.0000000
515,Shrek Forever After,"A bored and domesticated Shrek pacts with deal-maker Rumpelstiltskin to get back to feeling like a real ogre again, but when he's duped and sent to a twisted version of Far Far Away—where Rumpelstiltskin is king, ogres are hunted, and he and Fiona have never met—he sets out to restore his world and reclaim his true love.",It ain't Ogre... Til it's Ogre,93,165000000.0000,752600867.0000,https://image.tmdb.org/t/p/w342//6HrfPZtKcGmX2tUWW3cnciZTaSD.jpg,https://image.tmdb.org/t/p/original//xZ2we4gdiwQmg6D1w9qHlAm5yIf.jpg,https://www.imdb.com/title/tt0892791,https://www.themoviedb.org/movie/10192,en,2010-05-16 00:00:00.0000000
516,How the Grinch Stole Christmas,"Inside a snowflake exists the magical land of Whoville. In Whoville, live the Whos, an almost mutated sort of Munchkin-like people. All the Whos love Christmas, yet just outside of their beloved Whoville lives the Grinch. The Grinch is a nasty creature that hates Christmas, and plots to steal it away from the Whos, whom he equally abhors. Yet a small child, Cindy Lou Who, decides to try befriending the Grinch.",He puts the mean in green.,104,123000000.0000,345141403.0000,https://image.tmdb.org/t/p/w342//1WZbbPApEivA421gCOluuzMMKCk.jpg,https://image.tmdb.org/t/p/original//4dtbvoAaqiM3fVwzdffLxUdAiY6.jpg,https://www.imdb.com/title/tt0170016,https://www.themoviedb.org/movie/8871,en,2000-11-17 00:00:00.0000000
517,Star Trek Beyond,"The USS Enterprise crew explores the furthest reaches of uncharted space, where they encounter a mysterious new enemy who puts them and everything the Federation stands for to the test.",,122,185000000.0000,343471816.0000,https://image.tmdb.org/t/p/w342//65NVDW2LnHt2ko3m8ACxFo8E21f.jpg,https://image.tmdb.org/t/p/original//m4F1KRK5jAoQHi2mKDFE2jFKEIb.jpg,https://www.imdb.com/title/tt2660888,https://www.themoviedb.org/movie/188927,en,2016-07-07 00:00:00.0000000
518,Fast & Furious,"When a crime brings them back to L.A., fugitive ex-con Dom Toretto reignites his feud with agent Brian O'Conner. But as they are forced to confront a shared enemy, Dom and Brian must give in to an uncertain new trust if they hope to outmaneuver him. And the two men will find the best way to get revenge: push the limits of what's possible behind the wheel.",New Model. Original Parts.,107,85000000.0000,363164265.0000,https://image.tmdb.org/t/p/w342//AmY8rE2HzWzZs5S81CygXXYDjki.jpg,https://image.tmdb.org/t/p/original//3ZiM6gm2XL8qnhZCXsTjixvaH4v.jpg,https://www.imdb.com/title/tt1013752,https://www.themoviedb.org/movie/13804,en,2009-04-02 00:00:00.0000000
519,Hellboy,"In the final days of World War II, the Nazis attempt to use black magic to aid their dying cause. The Allies raid the camp where the ceremony is taking place, but not before a demon—Hellboy—has already been conjured. Joining the Allied forces, Hellboy eventually grows to adulthood, serving the cause of good rather than evil.",From the Dark Side to Our Side.,122,66000000.0000,99318987.0000,https://image.tmdb.org/t/p/w342//uE3uJHBiIJPzcWCZXwgYmxYQNnT.jpg,https://image.tmdb.org/t/p/original//v6ejJREqtrKoveHhX7q0mwP9iUd.jpg,https://www.imdb.com/title/tt0167190,https://www.themoviedb.org/movie/1487,en,2004-04-02 00:00:00.0000000
520,Rush,A biographical drama centered on the rivalry between Formula 1 drivers James Hunt and Niki Lauda during the 1976 Formula One motor-racing season.,Everyone's driven by something.,123,38000000.0000,90247624.0000,https://image.tmdb.org/t/p/w342//uWcMgxO3p3qwVFUxsRz1HbTzGvT.jpg,https://image.tmdb.org/t/p/original//c4m7c3qYLb5TQx6X7jR04aZHKOL.jpg,https://www.imdb.com/title/tt1979320,https://www.themoviedb.org/movie/96721,en,2013-09-02 00:00:00.0000000
521,Warcraft,"The peaceful realm of Azeroth stands on the brink of war as its civilization faces a fearsome race of invaders: orc warriors fleeing their dying home to colonize another. As a portal opens to connect the two worlds, one army faces destruction and the other faces extinction. From opposing sides, two heroes are set on a collision course that will decide the fate of their family, their people, and their home.",Two worlds. One home.,123,160000000.0000,433677183.0000,https://image.tmdb.org/t/p/w342//k3a41SS1q5xmbvzPvzTIfG7GDlp.jpg,https://image.tmdb.org/t/p/original//vEGTi4Hp0zGZnBfZ0gZcf7KvdQd.jpg,https://www.imdb.com/title/tt0803096,https://www.themoviedb.org/movie/68735,en,2016-05-25 00:00:00.0000000
522,The Expendables 2,"Mr. Church reunites the Expendables for what should be an easy paycheck, but when one of their men is murdered on the job, their quest for revenge puts them deep in enemy territory and up against an unexpected threat.",Back for War.,103,100000000.0000,314975955.0000,https://image.tmdb.org/t/p/w342//5kdnOxTei0Cgbi6pryFPZoX9apS.jpg,https://image.tmdb.org/t/p/original//41QdmNKbwmVD7R6A7hMqMe9FYMy.jpg,https://www.imdb.com/title/tt1764651,https://www.themoviedb.org/movie/76163,en,2012-08-08 00:00:00.0000000
523,Olympus Has Fallen,"When the White House (Secret Service Code: ""Olympus"") is captured by a terrorist mastermind and the President is kidnapped, disgraced former Presidential guard Mike Banning finds himself trapped within the building. As the national security team scrambles to respond, they are forced to rely on Banning's inside knowledge to help retake the White House, save the President and avert an even bigger disaster.",When our flag falls our nation will rise.,120,70000000.0000,161025640.0000,https://image.tmdb.org/t/p/w342//gKnx04MxnKcf5uOdhHhAAkqcCg.jpg,https://image.tmdb.org/t/p/original//2ZusF7y230mM1NRlg9Ktgrak9Dg.jpg,https://www.imdb.com/title/tt2302755,https://www.themoviedb.org/movie/117263,en,2013-03-20 00:00:00.0000000
524,Lost in Translation,"Two lost souls visiting Tokyo -- the young, neglected wife of a photographer and a washed-up movie star shooting a TV commercial -- find an odd solace and pensive freedom to be real in each other's company, away from their lives in America.",Everyone wants to be found.,102,4000000.0000,119723856.0000,https://image.tmdb.org/t/p/w342//wkSzJs7oMf8MIr9CQVICsvRfwA7.jpg,https://image.tmdb.org/t/p/original//6BVW7Tk0HvSGZqJ0NCnd2kLCJO3.jpg,https://www.imdb.com/title/tt0335266,https://www.themoviedb.org/movie/153,en,2003-09-18 00:00:00.0000000
525,The Girl with the Dragon Tattoo,"This English-language adaptation of the Swedish novel by Stieg Larsson follows a disgraced journalist, Mikael Blomkvist, as he investigates the disappearance of a weary patriarch's niece from 40 years ago. He is aided by the pierced, tattooed, punk computer hacker named Lisbeth Salander. As they work together in the investigation, Blomkvist and Salander uncover immense corruption beyond anything they have ever imagined.",Evil shall with evil be expelled.,158,90000000.0000,232617430.0000,https://image.tmdb.org/t/p/w342//vbLedKc1BUF4FOH1GyHW62FulCc.jpg,https://image.tmdb.org/t/p/original//dNFbrnF0mIBm0rClbfEFWTtsgMP.jpg,https://www.imdb.com/title/tt1568346,https://www.themoviedb.org/movie/65754,en,2011-12-14 00:00:00.0000000
526,Angels & Demons,"Harvard symbologist Robert Langdon is recruited by the Vatican to investigate the apparent return of the Illuminati - a secret, underground organization - after four cardinals are kidnapped on the night of the papal conclave.",The holiest event of our time. Perfect for their return.,138,150000000.0000,356613439.0000,https://image.tmdb.org/t/p/w342//uRBapeuwV8yy4in4BkETHBDmWkH.jpg,https://image.tmdb.org/t/p/original//aI0eMhmzuMNJOyZTua1hwchinWt.jpg,https://www.imdb.com/title/tt0808151,https://www.themoviedb.org/movie/13448,en,2009-05-13 00:00:00.0000000
527,A Good Day to Die Hard,"Iconoclastic, take-no-prisoners cop John McClane, finds himself for the first time on foreign soil after traveling to Moscow to help his wayward son Jack - unaware that Jack is really a highly-trained CIA operative out to stop a nuclear weapons heist. With the Russian underworld in pursuit, and battling a countdown to war, the two McClanes discover that their opposing methods make them unstoppable heroes.",Yippee Ki-Yay Mother Russia,98,92000000.0000,304654182.0000,https://image.tmdb.org/t/p/w342//evxtv4e8Amm436Y5rW16RkGu8pX.jpg,https://image.tmdb.org/t/p/original//wFUkS5cnMf3I8ysIPWzIXpTsuR7.jpg,https://www.imdb.com/title/tt1606378,https://www.themoviedb.org/movie/47964,en,2013-02-06 00:00:00.0000000
528,RED,"When his peaceful life is threatened by a high-tech assassin, former black-ops agent, Frank Moses reassembles his old team in a last ditch effort to survive and uncover his assailants.",Still armed. Still dangerous. Still got it.,111,58000000.0000,71664962.0000,https://image.tmdb.org/t/p/w342//jKntKE55uQTk38NwvkOMbxclBUT.jpg,https://image.tmdb.org/t/p/original//8HUZoAyrhmbbBUcRAdHPfH4r3GG.jpg,https://www.imdb.com/title/tt1245526,https://www.themoviedb.org/movie/39514,en,2010-10-13 00:00:00.0000000
529,Jack Reacher,"When a gunman takes five lives with six shots, all evidence points to the suspect in custody. On interrogation, the suspect offers up a single note: ""Get Jack Reacher!"" So begins an extraordinary chase for the truth, pitting Jack Reacher against an unexpected enemy, with a skill for violence and a secret to keep.",The Law Has Limits. He Does Not.,130,60000000.0000,218340595.0000,https://image.tmdb.org/t/p/w342//zlyhKMi2aLk25nOHnNm43MpZMtQ.jpg,https://image.tmdb.org/t/p/original//k7h4RNAarfOrF2r2YMN0P2FQSr4.jpg,https://www.imdb.com/title/tt0790724,https://www.themoviedb.org/movie/75780,en,2012-12-20 00:00:00.0000000
