Id,Title,Overview,Tagline,Runtime,Budget,Revenue,PosterUrl,BackdropUrl,ImdbUrl,TmdbUrl,OriginalLanguage,ReleaseDate
244,No Country for Old Men,"Llewelyn Moss stumbles upon dead bodies, $2 million and a hoard of heroin in a Texas desert, but methodical killer Anton Chigurh comes looking for it, with local sheriff Ed Tom Bell hot on his trail. The roles of prey and predator blur as the violent pursuit of money and justice collide.",There are no clean getaways.,122,25000000.0000,171627166.0000,https://image.tmdb.org/t/p/w342//6d5XOczc226jECq0LIX0siKtgHR.jpg,https://image.tmdb.org/t/p/original//kd9jFTTabg4xJpHDgxY0h8F9BzG.jpg,https://www.imdb.com/title/tt0477348,https://www.themoviedb.org/movie/6977,en,2007-11-08 00:00:00.0000000
245,Bruce Almighty,"Bruce Nolan toils as a 'human interest' television reporter in Buffalo, N.Y., but despite his high ratings and the love of his beautiful girlfriend, Bruce remains unfulfilled. At the end of the worst day in his life, he angrily ridicules God—and the Almighty responds, endowing Bruce with all of His divine powers.",In Bruce we trust.,101,80000000.0000,484592874.0000,https://image.tmdb.org/t/p/w342//nF9hly6Dk2pcQFSnuxugI34RpCC.jpg,https://image.tmdb.org/t/p/original//8C5eSpPh0d3feE9kdYznm4dfkp1.jpg,https://www.imdb.com/title/tt0315327,https://www.themoviedb.org/movie/310,en,2003-05-23 00:00:00.0000000
246,Cast Away,"Chuck Nolan, a top international manager for FedEx, and Kelly, a Ph.D. student, are in love and heading towards marriage. Then Chuck's plane to Malaysia crashes at sea during a terrible storm. He's the only survivor, and finds himself marooned on a desolate island. With no way to escape, Chuck must find ways to survive in his new home.","At the edge of the world, his journey begins.",143,90000000.0000,429632142.0000,https://image.tmdb.org/t/p/w342//4x4puNUAqBpi9sUMYL5dNPSdB6I.jpg,https://image.tmdb.org/t/p/original//mqYP8KJ0lrLcSzghe3o27mbciaU.jpg,https://www.imdb.com/title/tt0162222,https://www.themoviedb.org/movie/8358,en,2000-12-22 00:00:00.0000000
247,Insurgent,Beatrice Prior must confront her inner demons and continue her fight against a powerful alliance which threatens to tear her society apart.,One Choice Can Destroy You,119,110000000.0000,295238201.0000,https://image.tmdb.org/t/p/w342//hJij9DQUTLm7c0jNR6etlGZxMhB.jpg,https://image.tmdb.org/t/p/original//8YNNyQiPZlF9qv5EGOUK20mnXVk.jpg,https://www.imdb.com/title/tt2908446,https://www.themoviedb.org/movie/262500,en,2015-03-18 00:00:00.0000000
248,Once Upon a Time… in Hollywood,"Los Angeles, 1969. TV star Rick Dalton, a struggling actor specializing in westerns, and stuntman Cliff Booth, his best friend, try to survive in a constantly changing movie industry. Dalton is the neighbor of the young and promising actress and model Sharon Tate, who has just married the prestigious Polish director Roman Polanski…","In this town, it can all change… like that",162,95000000.0000,374251247.0000,https://image.tmdb.org/t/p/w342//8j58iEBw9pOXFD2L0nt0ZXeHviB.jpg,https://image.tmdb.org/t/p/original//b82nVVhYNRgtsTFV1jkdDwe6LJZ.jpg,https://www.imdb.com/title/tt7131622,https://www.themoviedb.org/movie/466272,en,2019-07-24 00:00:00.0000000
249,Kung Fu Panda,"When the Valley of Peace is threatened, lazy Po the panda discovers his destiny as the ""chosen one"" and trains to become a kung fu hero, but transforming the unsleek slacker into a brave warrior won't be easy. It's up to Master Shifu and the Furious Five -- Tigress, Crane, Mantis, Viper and Monkey -- to give it a try.",Prepare for awesomeness.,90,130000000.0000,631744560.0000,https://image.tmdb.org/t/p/w342//wWt4JYXTg5Wr3xBW2phBrMKgp3x.jpg,https://image.tmdb.org/t/p/original//qdthf9WrRDSaIkGVQGhhJ9pz1hn.jpg,https://www.imdb.com/title/tt0441773,https://www.themoviedb.org/movie/9502,en,2008-06-04 00:00:00.0000000
250,Spectre,"A cryptic message from Bond’s past sends him on a trail to uncover a sinister organization. While M battles political forces to keep the secret service alive, Bond peels back the layers of deceit to reveal the terrible truth behind SPECTRE.",A Plan No One Escapes,148,245000000.0000,880674609.0000,https://image.tmdb.org/t/p/w342//672kUEMtTHcaVYSVY4eiHEliHFa.jpg,https://image.tmdb.org/t/p/original//n1VZsWIi4missUgUXRfCG9HXFKe.jpg,https://www.imdb.com/title/tt2379713,https://www.themoviedb.org/movie/206647,en,2015-10-26 00:00:00.0000000
251,2001: A Space Odyssey,"Humanity finds a mysterious object buried beneath the lunar surface and sets off to find its origins with the help of HAL 9000, the world's most advanced super computer.",The Ultimate Trip.,149,12000000.0000,71923560.0000,https://image.tmdb.org/t/p/w342//ve72VxNqjGM69Uky4WTo2bK6rfq.jpg,https://image.tmdb.org/t/p/original//spoZUN4X1KiOc5S0plOyGAXLNtb.jpg,https://www.imdb.com/title/tt0062622,https://www.themoviedb.org/movie/62,en,1968-04-02 00:00:00.0000000
252,Furious 7,Deckard Shaw seeks revenge against Dominic Toretto and his family for his comatose brother.,Vengeance Hits Home,137,190000000.0000,1515047671.0000,https://image.tmdb.org/t/p/w342//ktofZ9Htrjiy0P6LEowsDaxd3Ri.jpg,https://image.tmdb.org/t/p/original//vkQvqH8WQkUiNklDcbUtHEUgSNQ.jpg,https://www.imdb.com/title/tt2820852,https://www.themoviedb.org/movie/168259,en,2015-04-01 00:00:00.0000000
253,Monsters University,A look at the relationship between Mike and Sulley during their days at Monsters University — when they weren't necessarily the best of friends.,School never looked this scary.,104,200000000.0000,743559607.0000,https://image.tmdb.org/t/p/w342//odW4WVN5hALNDQlL7A97nU6fiAv.jpg,https://image.tmdb.org/t/p/original//mIpCxBWNz6SHCQBe2K2PFr5MB7f.jpg,https://www.imdb.com/title/tt1453405,https://www.themoviedb.org/movie/62211,en,2013-06-19 00:00:00.0000000
254,Looper,"In the futuristic action thriller Looper, time travel will be invented but it will be illegal and only available on the black market. When the mob wants to get rid of someone, they will send their target 30 years into the past where a looper, a hired gun, like Joe is waiting to mop up. Joe is getting rich and life is good until the day the mob decides to close the loop, sending back Joe's future self for assassination.","Hunted by your future, haunted by your past.",118,30000000.0000,47042000.0000,https://image.tmdb.org/t/p/w342//sNjL6SqErDBE8OUZlrDLkexfsCj.jpg,https://image.tmdb.org/t/p/original//4bAwGmE9Sl4FeXoHWVWLXkURHbe.jpg,https://www.imdb.com/title/tt1276104,https://www.themoviedb.org/movie/59967,en,2012-09-26 00:00:00.0000000
255,Madagascar,"Alex the lion is the king of the urban jungle, the main attraction at New York’s Central Park Zoo. He and his best friends—Marty the zebra, Melman the giraffe and Gloria the hippo—have spent their whole lives in blissful captivity before an admiring public and with regular meals provided for them. Not content to leave well enough alone, Marty lets his curiosity get the better of him and makes his escape—with the help of some prodigious penguins—to explore the world.",Someone's got a zoo loose.,86,75000000.0000,542063846.0000,https://image.tmdb.org/t/p/w342//uHkmbxb70IQhV4q94MiBe9dqVqv.jpg,https://image.tmdb.org/t/p/original//8NCftAWfkETwrbf7QwEaDH1xpus.jpg,https://www.imdb.com/title/tt0351283,https://www.themoviedb.org/movie/953,en,2005-05-25 00:00:00.0000000
256,Sherlock Holmes: A Game of Shadows,"There is a new criminal mastermind at large (Professor Moriarty) and not only is he Holmes’ intellectual equal, but his capacity for evil and lack of conscience may give him an advantage over the  detective.",The game is afoot.,129,125000000.0000,334615000.0000,https://image.tmdb.org/t/p/w342//y1MYZkwhZK6L0Jy4YMuPktzDOfn.jpg,https://image.tmdb.org/t/p/original//lWNASscWXn32Asr9vkB1wq6cKvD.jpg,https://www.imdb.com/title/tt1515091,https://www.themoviedb.org/movie/58574,en,2011-11-22 00:00:00.0000000
257,Limitless,"A paranoia-fueled action thriller about an unsuccessful writer whose life is transformed by a top-secret ""smart drug"" that allows him to use 100% of his brain and become a perfect version of himself. His enhanced abilities soon attract shadowy forces that threaten his new life in this darkly comic and provocative film.",What if a pill could make you rich and powerful?,105,27000000.0000,161849455.0000,https://image.tmdb.org/t/p/w342//kCokPP4WCQRrrAuZ7FcpIyHr8b2.jpg,https://image.tmdb.org/t/p/original//vQGo5VjJcHxpzIa8lMBFzpAth1w.jpg,https://www.imdb.com/title/tt1219289,https://www.themoviedb.org/movie/51876,en,2011-03-08 00:00:00.0000000
258,21 Jump Street,"In high school, Schmidt was a dork and Jenko was the popular jock. After graduation, both of them joined the police force and ended up as partners riding bicycles in the city park. Since they are young and look like high school students, they are assigned to an undercover unit to infiltrate a drug ring that is supplying high school students synthetic drugs.",They thought the streets were mean. Then they went back to high school.,109,42000000.0000,201585328.0000,https://image.tmdb.org/t/p/w342//8v3Sqv9UcIUC4ebmpKWROqPBINZ.jpg,https://image.tmdb.org/t/p/original//lxCUDgZ54myV7goBrkpFoHRt9Ms.jpg,https://www.imdb.com/title/tt1232829,https://www.themoviedb.org/movie/64688,en,2012-03-14 00:00:00.0000000
259,Men in Black 3,"Agents J and K are back...in time. J has seen some inexplicable things in his 15 years with the Men in Black, but nothing, not even aliens, perplexes him as much as his wry, reticent partner. But when K's life and the fate of the planet are put at stake, Agent J will have to travel back in time to put things right. J discovers that there are secrets to the universe that K never told him - secrets that will reveal themselves as he teams up with the young Agent K to save his partner, the agency, and the future of humankind.",They are back... in time.,106,225000000.0000,624026776.0000,https://image.tmdb.org/t/p/w342//90DdoEStzeObs96fsYf4GG544iN.jpg,https://image.tmdb.org/t/p/original//44mAbdjGrJJQ4hzkKx2Z2EsninZ.jpg,https://www.imdb.com/title/tt1409024,https://www.themoviedb.org/movie/41154,en,2012-05-23 00:00:00.0000000
260,The Big Lebowski,"Jeffrey 'The Dude' Lebowski, a Los Angeles slacker who only wants to bowl and drink White Russians, is mistaken for another Jeffrey Lebowski, a wheelchair-bound millionaire, and finds himself dragged into a strange series of events involving nihilists, adult film producers, ferrets, errant toes, and large sums of money.",Times like these call for a Big Lebowski.,117,15000000.0000,46142637.0000,https://image.tmdb.org/t/p/w342//d4J7GotCjvDJBAYayZBTc5nLbbP.jpg,https://image.tmdb.org/t/p/original//77ElMccPnTMPouRxSdbJ4nEjf69.jpg,https://www.imdb.com/title/tt0118715,https://www.themoviedb.org/movie/115,en,1998-03-06 00:00:00.0000000
261,X-Men Origins: Wolverine,"After seeking to live a normal life, Logan sets out to avenge the death of his girlfriend by undergoing the mutant Weapon X program and becoming Wolverine.",Witness the Origin.,107,150000000.0000,373062864.0000,https://image.tmdb.org/t/p/w342//mQglrQzgZT0Oj9cQYPsLI8dsEqB.jpg,https://image.tmdb.org/t/p/original//wvqdJLVh0mSblly7UnYFPEk04Wd.jpg,https://www.imdb.com/title/tt0458525,https://www.themoviedb.org/movie/2080,en,2009-04-28 00:00:00.0000000
262,Slumdog Millionaire,"Jamal Malik is an impoverished Indian teen who becomes a contestant on the Hindi version of ‘Who Wants to Be a Millionaire?’ but, after he wins, he is suspected of cheating.","What does it take to find a lost love? A. Money, B. Luck, C. Smarts, D. Destiny",120,15000000.0000,377910544.0000,https://image.tmdb.org/t/p/w342//5WU6uusqJrLfiBaNs3KpF4o8Lnj.jpg,https://image.tmdb.org/t/p/original//9IZvClXvhSxlp41eT0CyUEsyjqy.jpg,https://www.imdb.com/title/tt1010048,https://www.themoviedb.org/movie/12405,en,2008-05-12 00:00:00.0000000
263,The Fate of the Furious,"When a mysterious woman seduces Dom into the world of crime and a betrayal of those closest to him, the crew face trials that will test them as never before.",Family no more,136,250000000.0000,1238764765.0000,https://image.tmdb.org/t/p/w342//dImWM7GJqryWJO9LHa3XQ8DD5NH.jpg,https://image.tmdb.org/t/p/original//jzdnhRhG0dsuYorwvSqPqqnM1cV.jpg,https://www.imdb.com/title/tt4630562,https://www.themoviedb.org/movie/337339,en,2017-04-12 00:00:00.0000000
264,Die Hard,"NYPD cop John McClane's plan to reconcile with his estranged wife is thrown for a serious loop when, minutes after he arrives at her office, the entire building is overtaken by a group of terrorists. With little help from the LAPD, wisecracking McClane sets out to single-handedly rescue the hostages and bring the bad guys down.",Forty Stories. Twelve Terrorists. One Cop.,131,28000000.0000,140767956.0000,https://image.tmdb.org/t/p/w342//1fq1IpnuVqkD5BMuaXAUW0eVB21.jpg,https://image.tmdb.org/t/p/original//qyNEqB6gl9V2GkiT88Pu36mqHnR.jpg,https://www.imdb.com/title/tt0095016,https://www.themoviedb.org/movie/562,en,1988-07-15 00:00:00.0000000
265,Jumanji,"When siblings Judy and Peter discover an enchanted board game that opens the door to a magical world, they unwittingly invite Alan -- an adult who's been trapped inside the game for 26 years -- into their living room. Alan's only hope for freedom is to finish the game, which proves risky as all three find themselves running from giant rhinoceroses, evil monkeys and other terrifying creatures.",Roll the dice and unleash the excitement!,104,65000000.0000,262797249.0000,https://image.tmdb.org/t/p/w342//vgpXmVaVyUL7GGiDeiK1mKEKzcX.jpg,https://image.tmdb.org/t/p/original//6w31RRm2s2CK1r3xDLf12WgIaHa.jpg,https://www.imdb.com/title/tt0113497,https://www.themoviedb.org/movie/8844,en,1995-12-15 00:00:00.0000000
266,The Fifth Element,"In 2257, a taxi driver is unintentionally given the task of saving a young girl who is part of the key that will ensure the survival of humanity.",There is no future without it.,126,90000000.0000,263920180.0000,https://image.tmdb.org/t/p/w342//fPtlCO1yQtnoLHOwKtWz7db6RGU.jpg,https://image.tmdb.org/t/p/original//wgvc3PmjQGtYYDWaeuV867mnFDs.jpg,https://www.imdb.com/title/tt0119116,https://www.themoviedb.org/movie/18,en,1997-05-02 00:00:00.0000000
267,The Conjuring,"Paranormal investigators Ed and Lorraine Warren work to help a family terrorized by a dark presence in their farmhouse. Forced to confront a powerful entity, the Warrens find themselves caught in the most terrifying case of their lives.",Based on the true case files of the Warrens,112,13000000.0000,319494638.0000,https://image.tmdb.org/t/p/w342//wVYREutTvI2tmxr6ujrHT704wGF.jpg,https://image.tmdb.org/t/p/original//l5yp73psXVRYy2ce09lD8yDuu2g.jpg,https://www.imdb.com/title/tt1457767,https://www.themoviedb.org/movie/138843,en,2013-03-20 00:00:00.0000000
268,The Hangover Part II,"The Hangover crew heads to Thailand for Stu's wedding. After the disaster of a bachelor party in Las Vegas last year, Stu is playing it safe with a mellow pre-wedding brunch. However, nothing goes as planned and Bangkok is the perfect setting for another adventure with the rowdy group.",The Wolfpack Is Back,102,80000000.0000,586764305.0000,https://image.tmdb.org/t/p/w342//7sGkjqorTHkaHTz8Q4WWHj8JL9t.jpg,https://image.tmdb.org/t/p/original//aGmsekNU5cMOkJMpbdRutkvmVMl.jpg,https://www.imdb.com/title/tt1411697,https://www.themoviedb.org/movie/45243,en,2011-05-25 00:00:00.0000000
269,The Perks of Being a Wallflower,"Pittsburgh, Pennsylvania, 1991. High school freshman Charlie is a wallflower, always watching life from the sidelines, until two senior students, Sam and her stepbrother Patrick, become his mentors, helping him discover the joys of friendship, music and love.",We are infinite.,103,13000000.0000,33400000.0000,https://image.tmdb.org/t/p/w342//aKCvdFFF5n80P2VdS7d8YBwbCjh.jpg,https://image.tmdb.org/t/p/original//qb6WoLJ9YtfhV7pgsTfUDlRYaCH.jpg,https://www.imdb.com/title/tt1659337,https://www.themoviedb.org/movie/84892,en,2012-09-20 00:00:00.0000000
270,Gran Torino,"Widower Walt Kowalski is a grumpy, prejudiced, tough-minded, unhappy, old, Korean War veteran who can't get along with either his kids or his neighbours. His prize possession is a 1972 Gran Torino he keeps in mint condition. When his neighbour, Thao—a young Hmong teenager under pressure from his gang member cousin—tries to steal his Gran Torino, Walt sets out to reform the youth and takes steps to protect Thao and his family from the gangs that infest their neighborhood.",Ever come across somebody you shouldn't have messed with?,116,33000000.0000,269958228.0000,https://image.tmdb.org/t/p/w342//w3zz8djZKknVpkpHi0I7kqibzbC.jpg,https://image.tmdb.org/t/p/original//2t82UwR1OtqBrDkbMMQRiRpTyi8.jpg,https://www.imdb.com/title/tt1205489,https://www.themoviedb.org/movie/13223,en,2008-12-09 00:00:00.0000000
271,Scarface,"After getting a green card in exchange for assassinating a Cuban government official, Tony Montana stakes a claim on the drug trade in Miami. Viciously murdering anyone who stands in his way, Tony eventually becomes the biggest drug lord in the state, controlling nearly all the cocaine that comes through Miami. But increased pressure from the police, wars with Colombian drug cartels and his own drug-fueled paranoia serve to fuel the flames of his eventual downfall.",The world is yours...,170,25000000.0000,66023329.0000,https://image.tmdb.org/t/p/w342//iQ5ztdjvteGeboxtmRdXEChJOHh.jpg,https://image.tmdb.org/t/p/original//cCvp5Sni75agCtyJkNOMapORUQV.jpg,https://www.imdb.com/title/tt0086250,https://www.themoviedb.org/movie/111,en,1983-12-09 00:00:00.0000000
272,Maze Runner: The Scorch Trials,"Thomas and his fellow Gladers face their greatest challenge yet: searching for clues about the mysterious and powerful organization known as WCKD. Their journey takes them to the Scorch, a desolate landscape filled with unimaginable obstacles. Teaming up with resistance fighters, the Gladers take on WCKD’s vastly superior forces and uncover its shocking plans for them all.",The Maze Was Just the Beginning.,132,61000000.0000,312296056.0000,https://image.tmdb.org/t/p/w342//mYw7ZyejqSCPFlrT2jHZOESZDU3.jpg,https://image.tmdb.org/t/p/original//4mcOCiR06dqQ5eoEJcG3zvonjOa.jpg,https://www.imdb.com/title/tt4046784,https://www.themoviedb.org/movie/294254,en,2015-09-09 00:00:00.0000000
273,Miss Peregrine's Home for Peculiar Children,A teenager finds himself transported to an island where he must help protect a group of orphans with special powers from creatures intent on destroying them.,Stay peculiar,127,110000000.0000,296482446.0000,https://image.tmdb.org/t/p/w342//6lSkpu2SDj71KTBy2DllM6CaFYA.jpg,https://image.tmdb.org/t/p/original//ld7V9BjMk2xtiBNcR8savyyk5ca.jpg,https://www.imdb.com/title/tt1935859,https://www.themoviedb.org/movie/283366,en,2016-09-27 00:00:00.0000000
274,Dead Poets Society,"At an elite, old-fashioned boarding school in New England, a passionate English teacher inspires his students to rebel against convention and seize the potential of every day, courting the disdain of the stern headmaster.",He was their inspiration. He made their lives extraordinary.,128,16400000.0000,235860116.0000,https://image.tmdb.org/t/p/w342//ai40gM7SUaGA6fthvsd87o8IQq4.jpg,https://image.tmdb.org/t/p/original//yYvBNN96Ym3wtPxGCFl7F888WwB.jpg,https://www.imdb.com/title/tt0097165,https://www.themoviedb.org/movie/207,en,1989-06-02 00:00:00.0000000
275,Kong: Skull Island,"Explore the mysterious and dangerous home of the king of the apes as a team of explorers ventures deep inside the treacherous, primordial island.",All hail the king,118,185000000.0000,566652812.0000,https://image.tmdb.org/t/p/w342//r2517Vz9EhDhj88qwbDVj8DCRZN.jpg,https://image.tmdb.org/t/p/original//x0RApsCncKWEMZgkqV6l8ZpCJ80.jpg,https://www.imdb.com/title/tt3731562,https://www.themoviedb.org/movie/293167,en,2017-03-08 00:00:00.0000000
276,Fantastic Beasts: The Crimes of Grindelwald,"Gellert Grindelwald has escaped imprisonment and has begun gathering followers to his cause—elevating wizards above all non-magical beings. The only one capable of putting a stop to him is the wizard he once called his closest friend, Albus Dumbledore. However, Dumbledore will need to seek help from the wizard who had thwarted Grindelwald once before, his former student Newt Scamander, who agrees to help, unaware of the dangers that lie ahead. Lines are drawn as love and loyalty are tested, even among the truest friends and family, in an increasingly divided wizarding world.",Fate of One. Future of All.,134,200000000.0000,653355901.0000,https://image.tmdb.org/t/p/w342//fMMrl8fD9gRCFJvsx0SuFwkEOop.jpg,https://image.tmdb.org/t/p/original//qrtRKRzoNkf5vemO9tJ2Y4DrHxQ.jpg,https://www.imdb.com/title/tt4123430,https://www.themoviedb.org/movie/338952,en,2018-11-14 00:00:00.0000000
277,Taxi Driver,"A mentally unstable Vietnam War veteran works as a night-time taxi driver in New York City where the perceived decadence and sleaze feed his urge for violent action, attempting to save a preadolescent prostitute in the process.","On every street in every city, there's a nobody who dreams of being a somebody.",114,1300000.0000,28262574.0000,https://image.tmdb.org/t/p/w342//ekstpH614fwDX8DUln1a2Opz0N8.jpg,https://image.tmdb.org/t/p/original//a58oc5qGNazb3QOxEH8eG5S7gjr.jpg,https://www.imdb.com/title/tt0075314,https://www.themoviedb.org/movie/103,en,1976-02-09 00:00:00.0000000
278,Nightcrawler,"When Lou Bloom, desperate for work, muscles into the world of L.A. crime journalism, he blurs the line between observer and participant to become the star of his own story. Aiding him in his effort is Nina, a TV-news veteran.",The city shines brightest at night,118,8500000.0000,50300000.0000,https://image.tmdb.org/t/p/w342//j9HrX8f7GbZQm1BrBiR40uFQZSb.jpg,https://image.tmdb.org/t/p/original//3kEfSOwBYhb11APEG0aUDysvW8F.jpg,https://www.imdb.com/title/tt2872718,https://www.themoviedb.org/movie/242582,en,2014-10-23 00:00:00.0000000
279,Prisoners,"Keller Dover faces a parent's worst nightmare when his 6-year-old daughter, Anna, and her friend go missing. The only lead is an old motorhome that had been parked on their street. The head of the investigation, Detective Loki, arrests the driver, but a lack of evidence forces Loki to release his only suspect. Dover, knowing that his daughter's life is at stake, decides that he has no choice but to take matters into his own hands.",Every moment matters.,153,46000000.0000,122126687.0000,https://image.tmdb.org/t/p/w342//tuZhZ6biFMr5n9YSVuHOJnNL1uU.jpg,https://image.tmdb.org/t/p/original//gv0p6gQM6tDkJFx2UpURWyCAjPn.jpg,https://www.imdb.com/title/tt1392214,https://www.themoviedb.org/movie/146233,en,2013-09-18 00:00:00.0000000
280,Casino Royale,"Le Chiffre, a banker to the world's terrorists, is scheduled to participate in a high-stakes poker game in Montenegro, where he intends to use his winnings to establish his financial grip on the terrorist market. M sends Bond—on his maiden mission as a 00 Agent—to attend this game and prevent Le Chiffre from winning. With the help of Vesper Lynd and Felix Leiter, Bond enters the most important poker game in his already dangerous career.",Everyone has a past. Every legend has a beginning.,144,150000000.0000,599045960.0000,https://image.tmdb.org/t/p/w342//wmRTS3WrXRi8GJdpDae1NifYNwx.jpg,https://image.tmdb.org/t/p/original//125H5AszmtAt0mYl2vpfChMFofv.jpg,https://www.imdb.com/title/tt0381061,https://www.themoviedb.org/movie/36557,en,2006-11-14 00:00:00.0000000
281,Night at the Museum,"Chaos reigns at the natural history museum when night watchman Larry Daley accidentally stirs up an ancient curse, awakening Attila the Hun, an army of gladiators, a Tyrannosaurus rex and other exhibits.",Where History Comes To Life,108,110000000.0000,574480841.0000,https://image.tmdb.org/t/p/w342//uY9k8t2FQkMj60obnAnsPKLxHCE.jpg,https://image.tmdb.org/t/p/original//zLbRMFVF5MVdM10Y5GzF34A3CSo.jpg,https://www.imdb.com/title/tt0477347,https://www.themoviedb.org/movie/1593,en,2006-10-20 00:00:00.0000000
282,Star Trek,"The fate of the galaxy rests in the hands of bitter rivals. One, James Kirk, is a delinquent, thrill-seeking Iowa farm boy. The other, Spock, a Vulcan, was raised in a logic-based society that rejects all emotion. As fiery instinct clashes with calm reason, their unlikely but powerful partnership is the only thing capable of leading their crew through unimaginable danger, boldly going where no one has gone before. The human adventure has begun again.",The future begins.,127,150000000.0000,385680446.0000,https://image.tmdb.org/t/p/w342//lV5OpzAss1z06YNagOVap1I35mH.jpg,https://image.tmdb.org/t/p/original//poSVFa61vWSCdl6PXthOvoCY6E0.jpg,https://www.imdb.com/title/tt0796366,https://www.themoviedb.org/movie/13475,en,2009-05-06 00:00:00.0000000
283,Home Alone,"Eight-year-old Kevin McCallister makes the most of the situation after his family unwittingly leaves him behind when they go on Christmas vacation. But when a pair of bungling burglars set their sights on Kevin's house, the plucky kid stands ready to defend his territory. By planting booby traps galore, adorably mischievous Kevin stands his ground as his frantic mother attempts to race home before Christmas Day.",A family comedy without the family.,103,18000000.0000,476684675.0000,https://image.tmdb.org/t/p/w342//9wSbe4CwObACCQvaUVhWQyLR5Vz.jpg,https://image.tmdb.org/t/p/original//vaVaNrscmsG8CUKYxiwZGFNqGJo.jpg,https://www.imdb.com/title/tt0099785,https://www.themoviedb.org/movie/771,en,1990-11-16 00:00:00.0000000
